{
  "schema_version": "1.0",
  "brand_id": "calapres",
  "idempotency_key": "aaaaaaaaaaaaaaaaaaaaaaaaaaaaaaaaaaaaaaaaaaaaaaaaaaaaaaaaaaaaaaaa",
  "outcome": "validated_no_write",
  "actor_type": "owner",
  "conversation_ref": "cwr_synthetic001",
  "incident_id": "inc_synthetic0001",
  "knowledge_version": null,
  "workflow_release": "calapres-owner-review-desk-v1",
  "audit_id": "aud_aaaaaaaaaaaaaaaaaaaaaaaa",
  "correlation_id": "calapres:synthetic:004",
  "created_at": "2026-08-11T09:08:01.000Z",
  "decision": "owner_decision_preview",
  "details_sanitized": "Validated owner action reply_only for incident inc_synthetic0001; preview only and no persistence executed.",
  "event_type": "owner_decision_recorded",
  "reason_code": "owner_decision_validated_no_write",
  "source_ref": "dec_synthetic0001"
}
